{
  "$schema": "https://json-schema.org/draft/2020-12/schema",
  "$id": "https://aid.local/plan.schema.json",
  "title": "AID Plan",
  "description": "Execution plan generated from an EPIC by the Planner. Defines steps, dependencies, parallel groups, and analysis groups for the Controller state machine.",
  "type": "object",
  "required": ["epic_id", "version", "steps", "dependencies"],
  "properties": {
    "epic_id": {
      "type": "string",
      "description": "Reference to the source EPIC identifier",
      "examples": ["AID-0001", "ERP-INV-01"]
    },
    "source_plan": {
      "type": ["string", "null"],
      "description": "Path to the source plan .md file (from EPIC plan_ref). Null for standalone EPICs without a source plan. When set, executing agents receive relevant plan sections for implementation detail.",
      "examples": [".aid-o/plans/2026-02-19-aido-v040-measurement-optimization.md", null]
    },
    "zadani": {
      "type": "string",
      "description": "The brief file the source plan is bound to (its frontmatter zadani:, P109). Absent when the plan names no brief."
    },
    "source_plan_sha256": {
      "type": "string",
      "pattern": "^[0-9a-f]{64}$",
      "description": "sha256 of the plan file this plan.json was generated from (P110): increment-step measures the step's criteria only from that plan, never from one edited since."
    },
    "direct": {
      "type": "boolean",
      "description": "P111: true when this plan.json was built by `aid-plan-fsm.sh plan-run` from the WHOLE plan (the direct run on plan/<id>), absent on the EPIC path."
    },
    "repo_roots": {
      "type": "array",
      "description": "P111: the foreign repositories the plan declares (frontmatter repo_roots), each worked in a worktree on plan/<id>-<project> — the ONE mapping the step contract, the step's return and the step check read.",
      "items": {
        "type": "object",
        "additionalProperties": false,
        "required": ["name", "path", "worktree", "branch", "base"],
        "properties": {
          "name": { "type": "string", "pattern": "^[a-z0-9][a-z0-9_-]*$", "description": "The slug a step's return names in repo_commits[].repo." },
          "path": { "type": "string", "description": "Physical path (realpath) of the foreign repository's live checkout — never written by a run." },
          "worktree": { "type": "string", "description": "<path>/.aid-worktrees/plan-<id>--<name>, where the run's foreign changes are made." },
          "branch": { "type": "string", "description": "plan/<id>-<project> — plan ids are per project." },
          "base": { "type": "string", "pattern": "^[0-9a-f]{40}$", "description": "The foreign base branch's head the worktree branch was created from." }
        }
      }
    },
    "zadani_sha256": {
      "type": "string",
      "pattern": "^[0-9a-f]{64}$",
      "description": "The brief's sha256 the source plan was bound to. Its presence makes the plan brief-bound: amend-scope then requires the brief point a widening serves."
    },
    "version": {
      "type": "integer",
      "minimum": 1,
      "description": "Plan version (incremented on re-planning)"
    },
    "created_at": {
      "type": "string",
      "format": "date-time",
      "description": "ISO 8601 timestamp of plan creation"
    },
    "steps": {
      "type": "array",
      "minItems": 1,
      "description": "Ordered list of execution steps",
      "items": {
        "type": "object",
        "required": ["id", "role", "objective"],
        "properties": {
          "id": {
            "type": "string",
            "pattern": "^step_[a-z0-9_]+$",
            "description": "Unique step identifier",
            "examples": ["step_1_backend", "step_2_docs"]
          },
          "role": {
            "type": "string",
            "enum": ["backend", "frontend", "qa", "security", "docs", "docs-writer", "release", "e2e"],
            "description": "Agent role to execute this step"
          },
          "objective": {
            "type": "string",
            "minLength": 10,
            "description": "What this step must accomplish"
          },
          "plan_step": {
            "type": ["integer", "null"],
            "minimum": 1,
            "description": "The plan's global step number (`### Step <n>:`) of this step, from the EPIC frontmatter's source_step_ids at the step's local index (P110). The per-step criterion run (aid-plan-diff.sh --step) reads that section's labelled criteria. null for an EPIC generated before 2.116.0."
          },
          "zavira": {
            "type": "array",
            "items": { "type": "string", "pattern": "^AC[0-9]+$" },
            "default": [],
            "description": "The brief points (AC<n>) this step closes, from the plan step's **Zavírá:** through the EPIC steps table's Closes column (P109). Empty for a step that closes none and for an EPIC generated before 2.115.0."
          },
          "inputs": {
            "type": "array",
            "items": { "type": "string" },
            "description": "Required inputs (from EPIC or previous step outputs)"
          },
          "outputs": {
            "type": "array",
            "items": { "type": "string" },
            "description": "Expected outputs (files, artifacts, decisions)"
          },
          "constraints": {
            "type": "array",
            "items": { "type": "string" },
            "description": "Step-specific constraints"
          },
          "allowed_paths": {
            "type": "array",
            "items": { "type": "string" },
            "description": "Filesystem paths this step may modify"
          },
          "forbidden_paths": {
            "type": "array",
            "items": { "type": "string" },
            "description": "Filesystem paths this step must NOT touch"
          },
          "acceptance_criteria": {
            "type": "array",
            "items": { "type": "string" },
            "description": "Verifiable criteria that must be met for this step to pass acceptance validation. Each criterion should be specific and testable."
          },
          "model": {
            "type": "string",
            "enum": ["haiku", "sonnet", "opus"],
            "description": "Optional per-step override of the model tier. When absent (the normal case) the model is taken from the step role's card in skills/role-cards.md at dispatch time (single source of truth). The Planner script does not populate this field."
          },
          "context_scope": {
            "type": "object",
            "description": "Controls which context sources are injected into the dispatch prompt. Defaults to all-context when not specified.",
            "properties": {
              "memory": {
                "type": "boolean",
                "default": true,
                "description": "Whether to inject Qdrant memory context"
              },
              "previous_outputs": {
                "type": "string",
                "enum": ["all", "direct", "none"],
                "default": "all",
                "description": "Which previous step outputs to include: all = all prior steps, direct = only direct dependencies, none = skip"
              }
            },
            "additionalProperties": false
          },
          "wiring": {
            "type": "boolean",
            "default": false,
            "description": "Indicates this is an auto-generated wiring step that integrates shared files from parallel steps. Set to true only by the Planner's POST_WAVE_WIRING_CHECK."
          },
          "visual_refs": {
            "type": "array",
            "items": { "type": "string" },
            "description": "Relative paths to mockup files (source code or images) for this step. Controller reads these before dispatch and generates visual-spec.yaml.",
            "examples": [".aid-o/plans/P011/mockups/CompanyDashboard.tsx", ".aid-o/plans/P011/mockups/dashboard-mockup.png"]
          },
          "ui_change_mode": {
            "type": ["string", "null"],
            "enum": ["existing_ui", "new_ui", null],
            "description": "When present, specifies whether this step modifies existing UI (real capture) or creates new UI (mockup-based)"
          },
          "ui_change_contract": {
            "type": ["object", "null"],
            "description": "Typed delta contract for existing_ui steps — path reference + integrity hash",
            "properties": {
              "path": { "type": "string", "description": "Path to the delta contract JSON file" },
              "sha256": { "type": "string", "description": "SHA256 hash of the contract file" },
              "schema_version": { "type": "string", "description": "Schema version of the contract" }
            },
            "required": ["path", "sha256", "schema_version"],
            "additionalProperties": false
          },
          "wiring_context": {
            "type": "object",
            "description": "Context for wiring steps (only present when wiring=true). Describes which files are shared, which steps produced them, and what integration actions are expected.",
            "properties": {
              "shared_files": {
                "type": "array",
                "items": { "type": "string" },
                "description": "File paths that were modified by multiple parallel steps and need integration."
              },
              "contributing_steps": {
                "type": "array",
                "items": { "type": "string" },
                "description": "Step IDs of the parallel steps that produced changes to the shared files."
              },
              "expected_actions": {
                "type": "array",
                "items": { "type": "string" },
                "description": "Descriptions of what the wiring step should do to integrate the shared files."
              }
            },
            "required": ["shared_files", "contributing_steps", "expected_actions"],
            "additionalProperties": false
          }
        },
        "additionalProperties": false
      }
    },
    "dependencies": {
      "type": "array",
      "description": "Explicit ordering constraints between steps",
      "items": {
        "type": "object",
        "required": ["before", "after"],
        "properties": {
          "before": {
            "type": "string",
            "description": "Step ID that must complete first"
          },
          "after": {
            "type": "string",
            "description": "Step ID that depends on 'before'"
          },
          "reason": {
            "type": "string",
            "description": "Why this dependency exists"
          }
        },
        "additionalProperties": false
      }
    },
    "parallel_groups": {
      "type": "array",
      "description": "Groups of step IDs that can execute concurrently (different work in parallel)",
      "items": {
        "type": "array",
        "items": { "type": "string" },
        "minItems": 2
      }
    },
    "analysis_groups": {
      "type": "array",
      "description": "Multi-perspective analysis groups — multiple agents analyze the SAME target step from different perspectives. Unlike parallel_groups (different work), analysis_groups are read-only reviews of completed work.",
      "items": {
        "type": "object",
        "required": ["id", "target", "agents", "mode", "merge_strategy"],
        "properties": {
          "id": {
            "type": "string",
            "pattern": "^analysis_[0-9]+_[a-z_]+$",
            "description": "Unique analysis group identifier",
            "examples": ["analysis_1_security_review", "analysis_2_db_validation"]
          },
          "target": {
            "type": "string",
            "pattern": "^step_[a-z0-9_]+$",
            "description": "Step ID being analyzed (must reference an existing step)"
          },
          "agents": {
            "type": "array",
            "items": {
              "type": "string",
              "enum": ["backend", "frontend", "qa", "security", "docs", "docs-writer", "release", "e2e"]
            },
            "minItems": 1,
            "description": "Agent roles performing the analysis — must NOT include the target step's own agent role"
          },
          "mode": {
            "type": "string",
            "enum": ["review", "audit", "validation"],
            "description": "Analysis mode: review = findings list, audit = scoring (0-100), validation = pass/fail"
          },
          "merge_strategy": {
            "type": "string",
            "enum": ["union", "consensus", "weighted"],
            "description": "How to merge findings from multiple agents: union = all findings, consensus = 2+ agree, weighted = domain expertise weights"
          },
          "trigger": {
            "type": "string",
            "enum": ["auto", "manual"],
            "default": "auto",
            "description": "Whether this group was auto-generated by Planner rules or manually specified in EPIC"
          }
        },
        "additionalProperties": false
      }
    },
    "gates": {
      "type": "array",
      "description": "Quality gate names to run after all steps complete. Any non-empty gate name is accepted here — this schema does NOT enumerate a fixed set of valid gates (self-host and per-project gates both flow through this field). Consumed by aid-run-gates.sh, which reconciles each name against the gate definitions in execution.yaml: a name present here but NOT defined in execution.yaml is an undefined gate — the runner emits a report row {result: fail, reason: undefined_gate} and forces overall: fail (it never silently disappears). Every name listed here MUST have a matching gate definition in execution.yaml.",
      "items": {
        "type": "string",
        "minLength": 1
      }
    },
    "visual_assets": {
      "type": "object",
      "description": "Visual mockup metadata for the plan",
      "properties": {
        "mockup_dir": { "type": "string", "description": "Path to mockups directory" },
        "visual_spec": { "type": ["string", "null"], "description": "Path to visual-spec.yaml" },
        "source_type": { "type": "string", "enum": ["github", "ai_studio", "image", "companion"], "description": "How mockups were provided" }
      },
      "additionalProperties": false
    },
    "budget": {
      "type": "object",
      "properties": {
        "max_llm_cost_usd": {
          "type": "number",
          "minimum": 0,
          "description": "Maximum LLM cost for this plan execution"
        },
        "max_retries_per_gate": {
          "type": "integer",
          "minimum": 0,
          "maximum": 5,
          "default": 3
        }
      },
      "additionalProperties": false
    }
  },
  "additionalProperties": false
}
