{
  "epic_id": "E-C0-LOW-1_1",
  "source_plan": "plugins/aid-orchestrator/scripts/tests/fixtures/c0/clean-low-risk/plan.md",
  "version": 1,
  "created_at": "2026-06-28T00:00:00Z",
  "steps": [
    {
      "id": "step_1",
      "role": "backend",
      "objective": "Implement the single-step feature.",
      "inputs": ["EPIC specification"],
      "outputs": ["src/simple_feature.py"],
      "constraints": [],
      "allowed_paths": ["src/simple_feature.py"],
      "forbidden_paths": [],
      "acceptance_criteria": ["Feature works correctly"]
    }
  ],
  "dependencies": [],
  "parallel_groups": [],
  "analysis_groups": [],
  "gates": ["tests_pass"],
  "budget": {
    "max_retries_per_gate": 3
  }
}
